{
  "$schema": "./developer-apps.schema.json",
  "schemaVersion": 2,
  "updatedAt": "2026-10-04",
  "sourceRevision": "25d55aa4f1b3c2b912934dc86e01498f2b9e1a01",
  "apps": [
    {
      "id": "forgeplay",
      "appStoreID": null,
      "name": "ForgePlay",
      "platform": "mac",
      "kind": "app",
      "summaries": {
        "ko": "Apple Silicon Mac에서 Windows 게임을 macOS 네이티브 게임 모드로 실행하는 세계 최초의 앱입니다.",
        "en": "The world’s first app to run Windows games in native macOS Game Mode on Apple Silicon Macs.",
        "de": "Die weltweit erste App, die Windows-Spiele auf Apple-Silicon-Macs im nativen macOS-Spielmodus ausführt.",
        "es": "La primera app del mundo que ejecuta juegos de Windows en el modo Juego nativo de macOS en equipos Mac con Apple Silicon.",
        "fr": "La première app au monde à exécuter des jeux Windows dans le mode Jeu natif de macOS sur les Mac avec puce Apple.",
        "ja": "Appleシリコン搭載MacでWindowsゲームをmacOSネイティブのゲームモードで実行する、世界初のアプリです。",
        "zh-Hans": "全球首款可在 Apple 芯片 Mac 上以 macOS 原生游戏模式运行 Windows 游戏的 App。",
        "zh-Hant": "全球首款可在 Apple 晶片 Mac 上以 macOS 原生遊戲模式執行 Windows 遊戲的 App。"
      },
      "supportedLanguages": ["en", "ko", "es", "de", "ja", "zh-Hans", "zh-Hant", "fr"],
      "appleSiliconMacCompatible": false,
      "artwork": "site-assets/forgeplay-icon.png",
      "href": "index.html"
    },
    {
      "id": "majordex",
      "appStoreID": "6806726163",
      "name": "MajorDex",
      "platform": "mac",
      "kind": "app",
      "summaries": {
        "en": "A macOS app that analyzes a selected project in read-only mode, without running it, so you can explore its structure and execution flow visually.",
        "ko": "선택한 프로젝트를 실행하지 않고 읽기 전용으로 분석해 구조와 실행 흐름을 시각적으로 살펴볼 수 있는 macOS 앱입니다.",
        "de": "Eine macOS-App, die ein ausgewähltes Projekt schreibgeschützt analysiert, ohne es auszuführen, sodass Struktur und Ausführungsablauf visuell untersucht werden können.",
        "es": "Una app para macOS que analiza en modo de solo lectura un proyecto seleccionado, sin ejecutarlo, para explorar visualmente su estructura y flujo de ejecución.",
        "fr": "Une app macOS qui analyse un projet sélectionné en lecture seule, sans l’exécuter, afin d’en explorer visuellement la structure et le flux d’exécution.",
        "ja": "選択したプロジェクトを実行せずに読み取り専用で解析し、構造と実行フローを視覚的に確認できるmacOSアプリです。",
        "zh-Hans": "这是一款 macOS App，可在不运行所选项目的情况下以只读方式进行分析，并以可视化方式查看其结构和执行流程。",
        "zh-Hant": "這是一款 macOS App，可在不執行所選專案的情況下以唯讀方式分析，並以視覺化方式查看其結構與執行流程。"
      },
      "supportedLanguages": [
        "en",
        "ko",
        "es",
        "de",
        "ja",
        "zh-Hans",
        "zh-Hant",
        "fr"
      ],
      "appleSiliconMacCompatible": false,
      "artwork": "site-assets/developer-apps/majordex-appstore-20260929.png",
      "href": "https://apps.apple.com/us/app/majordex/id6806726163"
    },
    {
      "id": "hopdisk",
      "appStoreID": "6782226580",
      "name": "HopDisk",
      "platform": "mac",
      "kind": "app",
      "summaries": {
        "ko": "Mac 저장공간의 실제 사용량을 분석하고 정리할 항목을 안전하게 검토합니다.",
        "en": "Analyze actual Mac storage usage and safely review items you can clean up.",
        "de": "Analysiert die tatsächliche Speichernutzung deines Mac und hilft, aufräumbare Elemente sicher zu prüfen.",
        "es": "Analiza el uso real del almacenamiento del Mac y revisa de forma segura qué elementos puedes limpiar.",
        "fr": "Analyse l’utilisation réelle du stockage de votre Mac et permet d’examiner en toute sécurité les éléments pouvant être nettoyés.",
        "ja": "Macストレージの実際の使用量を分析し、安全に整理できる項目を確認します。",
        "zh-Hans": "分析 Mac 存储空间的实际使用量，并安全检查可清理的项目。",
        "zh-Hant": "分析 Mac 儲存空間的實際使用量，並安全檢查可清理的項目。"
      },
      "supportedLanguages": ["en", "ko", "es", "de", "ja", "zh-Hans", "zh-Hant", "fr"],
      "appleSiliconMacCompatible": false,
      "artwork": "site-assets/developer-apps/hopdisk.png",
      "href": "https://apps.apple.com/us/app/hopdisk/id6782226580"
    },
    {
      "id": "bunmixer",
      "appStoreID": "6785348274",
      "name": "BunMixer",
      "platform": "mac",
      "kind": "app",
      "summaries": {
        "ko": "시스템 음량은 그대로 두고 지원되는 앱의 재생 음량을 앱별로 조절합니다.",
        "en": "Keep system volume unchanged while controlling playback volume separately for supported apps.",
        "de": "Behält die Systemlautstärke bei und regelt die Wiedergabelautstärke unterstützter Apps separat.",
        "es": "Mantén el volumen del sistema y controla por separado el volumen de reproducción de las apps compatibles.",
        "fr": "Conserve le volume système tout en réglant séparément le volume de lecture des apps compatibles.",
        "ja": "システム音量を変えずに、対応アプリの再生音量をアプリごとに調整します。",
        "zh-Hans": "保持系统音量不变，分别调节受支持 App 的播放音量。",
        "zh-Hant": "保持系統音量不變，分別調整支援 App 的播放音量。"
      },
      "supportedLanguages": ["en", "ko", "es", "de", "ja", "zh-Hans", "zh-Hant", "fr"],
      "appleSiliconMacCompatible": false,
      "artwork": "site-assets/developer-apps/bunmixer.png",
      "href": "https://apps.apple.com/us/app/bunmixer/id6785348274"
    },
    {
      "id": "latchcast",
      "appStoreID": "6781878576",
      "name": "LatchCast",
      "platform": "mac",
      "kind": "app",
      "summaries": {
        "ko": "선택한 앱 창과 관련 오디오를 로컬 동영상 파일로 녹화합니다.",
        "en": "Record a selected app window and related audio to a local video file.",
        "de": "Zeichnet ein ausgewähltes App-Fenster und zugehöriges Audio in einer lokalen Videodatei auf.",
        "es": "Graba la ventana de una app seleccionada y el audio relacionado en un archivo de vídeo local.",
        "fr": "Enregistre la fenêtre d’une app sélectionnée et le son associé dans un fichier vidéo local.",
        "ja": "選択したアプリのウインドウと関連する音声をローカルの動画ファイルに録画します。",
        "zh-Hans": "将所选 App 窗口及相关音频录制为本地视频文件。",
        "zh-Hant": "將所選 App 視窗及相關音訊錄製為本機影片檔案。"
      },
      "supportedLanguages": ["en", "ko", "es", "de", "ja", "zh-Hans", "zh-Hant", "fr"],
      "appleSiliconMacCompatible": false,
      "artwork": "site-assets/developer-apps/latchcast.png",
      "href": "https://apps.apple.com/us/app/latchcast/id6781878576"
    },
    {
      "id": "lorabit",
      "appStoreID": "6763971665",
      "name": "LoRAbit",
      "platform": "mac",
      "kind": "app",
      "summaries": {
        "ko": "데이터 준비부터 MLX LoRA 학습과 결과 내보내기까지 로컬에서 관리합니다.",
        "en": "Manage dataset preparation, MLX LoRA training, and result export locally.",
        "de": "Verwaltet Datenvorbereitung, MLX-LoRA-Training und den Export der Ergebnisse lokal.",
        "es": "Gestiona localmente la preparación de datos, el entrenamiento LoRA con MLX y la exportación de resultados.",
        "fr": "Gère localement la préparation des données, l’entraînement LoRA avec MLX et l’exportation des résultats.",
        "ja": "データ準備からMLXによるLoRA学習、結果の書き出しまでをローカルで管理します。",
        "zh-Hans": "在本地管理数据准备、MLX LoRA 训练和结果导出。",
        "zh-Hant": "在本機管理資料準備、MLX LoRA 訓練和結果匯出。"
      },
      "supportedLanguages": ["en", "ko", "es", "de", "ja", "fr"],
      "appleSiliconMacCompatible": false,
      "artwork": "site-assets/developer-apps/lorabit.png",
      "href": "https://apps.apple.com/us/app/lorabit/id6763971665"
    },
    {
      "id": "kanindex",
      "appStoreID": "6765845295",
      "name": "KaninDex",
      "platform": "mac",
      "kind": "app",
      "summaries": {
        "ko": "AI가 만든 코드의 구조, 관계, 실행 흐름과 위험 지점을 이해하기 쉽게 분석합니다.",
        "en": "Understand AI-generated code by analyzing its structure, relationships, execution flow, and risks.",
        "de": "Macht KI-generierten Code verständlich, indem Struktur, Beziehungen, Ausführungsablauf und Risiken analysiert werden.",
        "es": "Comprende el código generado por IA analizando su estructura, relaciones, flujo de ejecución y riesgos.",
        "fr": "Facilite la compréhension du code généré par l’IA en analysant sa structure, ses relations, son flux d’exécution et ses risques.",
        "ja": "AIが生成したコードの構造、関係、実行フロー、リスクを分析し、理解しやすくします。",
        "zh-Hans": "分析 AI 生成代码的结构、关系、执行流程和风险，帮助你轻松理解代码。",
        "zh-Hant": "分析 AI 產生程式碼的結構、關係、執行流程和風險，協助你輕鬆理解程式碼。"
      },
      "supportedLanguages": ["en", "ko", "es", "de", "ja", "fr"],
      "appleSiliconMacCompatible": false,
      "artwork": "site-assets/developer-apps/kanindex.png",
      "href": "https://apps.apple.com/us/app/kanindex/id6765845295"
    },
    {
      "id": "bunniki",
      "appStoreID": "6763970447",
      "name": "Bunniki",
      "platform": "ipad",
      "kind": "app",
      "summaries": {
        "ko": "선택한 문서와 소스 폴더를 구조화된 Markdown 위키로 정리하고 탐색·질문·번역합니다.",
        "en": "Organize selected documents and source folders into a structured Markdown wiki for browsing, questions, and translation.",
        "de": "Ordnet ausgewählte Dokumente und Quellordner in einem strukturierten Markdown-Wiki zum Durchsuchen, Fragen und Übersetzen.",
        "es": "Organiza los documentos y las carpetas de origen seleccionados en una wiki Markdown estructurada para explorar, hacer preguntas y traducir.",
        "fr": "Organise les documents et dossiers sources sélectionnés dans un wiki Markdown structuré pour les parcourir, poser des questions et les traduire.",
        "ja": "選択した文書とソースフォルダを構造化されたMarkdown Wikiに整理し、閲覧・質問・翻訳できます。",
        "zh-Hans": "将所选文档和源文件夹整理为结构化 Markdown Wiki，以便浏览、提问和翻译。",
        "zh-Hant": "將所選文件與來源檔案夾整理為結構化 Markdown Wiki，以便瀏覽、提問和翻譯。"
      },
      "supportedLanguages": ["en", "ko", "es", "de", "ja", "fr"],
      "appleSiliconMacCompatible": true,
      "artwork": "site-assets/developer-apps/bunniki.jpg",
      "href": "https://apps.apple.com/us/app/bunniki/id6763970447"
    },
    {
      "id": "openbooklm",
      "appStoreID": "6761378169",
      "name": "OpenBookLM",
      "platform": "ipad",
      "kind": "app",
      "summaries": {
        "ko": "Obsidian Vault나 문서 폴더를 연결해 검색, 질문, 읽기와 번역을 한곳에서 처리합니다.",